### ISSUE TITLE
SYSLOG TCP issues

### ISSUE THREAD

**Issue by chadell** [nokia/srlinux-container-image#7]
In a Docker network, I have an SRLinux and a Syslog receiver (among other components). The SRLinux can't send syslog messages over TCP because the TCP session can't be established. Chagning to UDP, worked.

More details:
- The syslog receiver is able to receive TCP communications over the TCP port (198.51.100.1:1515). Validated from other containers.
- The SRLinux, only sees SYN messges going out
```
admin@srl1:~$ tcpdump -vAnni any dst 198.51.100.1 and tcp port 1515
tcpdump: data link type LINUX_SLL2
tcpdump: listening on any, link-type LINUX_SLL2 (Linux cooked v2), snapshot length 262144 bytes
18:25:52.961360 mgmt0.0 Out IP (tos 0x0, ttl 64, id 31095, offset 0, flags [DF], proto TCP (6), length 60)
198.51.100.2.41996 > 198.51.100.1.1515: Flags [S], cksum 0x447a (correct), seq 3908597520, win 64240, options [mss 1460,sackOK,TS val 1781088256 ecr 0,nop,wscale 7], length 0
E..<yw@.@.l..3d..3d.......w.........Dz.........
j)@.........
```
- In the Linux host, I check the docker bridge and I see the SYN/ACK packet from the syslog server being sent
```
# nsenter --net=/var/run/docker/netns/9be0fdf2a51b \
  tcpdump -nni any host 198.51.100.1 and tcp port 1515
tcpdump: data link type LINUX_SLL2
tcpdump: verbose output suppressed, use -v[v]... for full protocol decode
listening on any, link-type LINUX_SLL2 (Linux cooked v2), snapshot length 262144 bytes
07:38:38.083811 mgmt0 Out IP 198.51.100.2.44772 > 198.51.100.1.1515: Flags [S], seq 1065676156, win 64240, options [mss 1460,sackOK,TS val 1466515835 ecr 0,nop,wscale 7], length 0
07:38:38.083930 mgmt0 In  IP 198.51.100.1.1515 > 198.51.100.2.44772: Flags [S.], seq 4281736253, ack 1065676157, win 65160, options [mss 1460,sackOK,TS val 923046376 ecr 1466515835,nop,wscale 7], length 0
```
- It seems to me that the reverse path is not properly forwarded to the inner mgmt0 interface in the SRLinux container.

**Comment by hellt** [comment]
Hi @chadell 
what SR Linux version are you using? Do you happen to have a small reproduction in a clab format?

**Comment by chadell** [comment]
Hi @hellt , I'm using the `latest`, and this is the clab toplogy:

```
name: mno-webinar
mgmt:
  network: network-observability
  ipv4-subnet: 198.51.100.0/24
topology:
  nodes:
    srl1:
      kind: nokia_srlinux
      image: ghcr.io/nokia/srlinux
      mgmt-ipv4: 198.51.100.2
      startup-config: startups/startup-config-srl1.json
      ports:
        - 80/tcp
        - 443/tcp
        - 57400/tcp
        - 161/udp
    srl2:
      kind: nokia_srlinux
      image: ghcr.io/nokia/srlinux
      mgmt-ipv4: 198.51.100.3
      startup-config: startups/startup-config-srl2.json
      ports:
        - 80/tcp
        - 443/tcp
        - 57400/tcp
        - 161/udp
  links:
    - endpoints: ["srl1:e1-1", "srl2:e1-1"]
```

The logging config for startup is like this:
```
        "srl_nokia-logging:logging": {
            "network-instance": "mgmt",
            ...
            "remote-server": [
                {
                    "host": "198.51.100.25",
                    "transport": "tcp",
                    "remote-port": 1515,
                    "subsystem": [
                        {
                            "subsystem-name": "srl_nokia-logging:aaa",
                            "priority": {
                                "match-above": "debug"
                            }
                        },
```
and the docker network `network-observability` it's defined in an external docker-compose like this:
```
networks:
  network-observability:
    external: true
    name: network-observability

services:
  logstash:
    container_name: logstash
    image: ${LOGSTASH_LOKI_IMAGE:-docker.io/grafana/logstash-output-loki:3.1.1}
    command: -f /home/logstash/logstash.cfg
    volumes:
      - ./logstash/logstash.cfg:/home/logstash/logstash.cfg
    ports:
      - 1515:1515
      - 1515:1515/udp
      - 9600:9600
      - 12201:12201/udp
    environment:
      XPACK_MONITORING_ENABLED: false
    env_file:
      - ../../.env
    networks:
      network-observability:
        ipv4_address: 198.51.100.25
    logging:
      driver: gelf
      options:
        gelf-address: "udp://0.0.0.0:12201"
```

**Comment by hellt** [comment]
can you plz provide `show version` output from the srl container?

**Comment by chadell** [comment]
```
A:admin@srl1# show version
---------------------------------------------------------------------------------------------------------------------------------------------------------------------------------------------------------------
Hostname             : srl1
Chassis Type         : 7220 IXR-D2L
Part Number          : Sim Part No.
Serial Number        : Sim Serial No.
System HW MAC Address: 1A:C3:00:FF:00:00
OS                   : SR Linux
Software Version     : v25.10.1
Build Number         : 399-g90c1dbe35ef
Architecture         : x86_64
Last Booted          : 2026-01-18T15:41:03.779Z
Total Memory         : 8127928 kB
Free Memory          : 2558288 kB
---------------------------------------------------------------------------------------------------------------------------------------------------------------------------------------------------------------

```

**Comment by hellt** [comment]
@chadell since you are using a new port, you need to add a CPM rule allowing it:

```
/acl acl-filter cpm type ipv4 entry 500
A:dut1# info
    match {
        ipv4 {
            protocol tcp
        }
        transport {
            source-port {
                value 1515
            }
        }
    }
    action {
        accept {
        }
    }
```

**Comment by chadell** [comment]
🤦 thanks @hellt ... I went on the complicated path rather than check the basics.

**Comment by hellt** [comment]
wait a sec, though. I think I was wrong in suggesting this as a solution as the traffic is outgoing, not incoming in this case.

unless it suddenly worked in your case. Was early morning for me, so I rushed :D

**Comment by chadell** [comment]
well, I was planning to test it but your proposal made sense.

However, your are right, the issue I detected is on the SYN/ACK packets going back into the mgmt interface from the Docker network

**Comment by hellt** [comment]
**ADD1:**

Yeah, this rule is required. Sorry, I was dumb twice today. This rule actually matches on the returned traffic **source** port, not the destination. And the source-port in your case is indeed 1515 for which you need to add a rule.

---

if you still have your setup you can check if adding this rule make any difference still

**Comment by chadell** [comment]
I am gonna try it, but not sure when I have cycles
